id,text,created_at,retweet_count,favorite_count,source,length,user_id,user_screen_name,user_name,user_created_at,user_description,user_followers_count,user_friends_count,user_location,user_statuses_count,user_verified,user_url,number_of_QuestionMarks,user_has_url?,label,score
1253540146705657856,"“But The world will not and can not go back to the way things are, there must be a “new normal” 😶😶 https://t.co/Kv7htvw1O9",2020-04-24 04:23:55,0,0,Twitter for iPhone,122,44313421,alifafaza,Cut Alifa Faza,2009-06-03 07:12:45,,740,284,nomaden,17837,False,,,No,NEGATIVE,0.9800755977630615
1253540142989656064,"@HemantSorenJMM @jharkhand181 Respected CM sir, Dr. Said eat non veg. For increasing immunity system for fight agai… https://t.co/7halHiir7K",2020-04-24 04:23:54,0,0,Twitter for Android,140,1238649209324093440,Alam007Intakhab,Intakhab_Alam007,2020-03-14 02:13:15,Think globally act locally.,10,64,,82,False,,,No,NEGATIVE,0.8626061677932739
1253540140980375553,"@ChouhanShivraj  @narendramodi @drharshvardhan  I have urged you multiple times, this could be a solution to this c… https://t.co/0EsmT8F7Ke",2020-04-24 04:23:53,0,0,Twitter for Android,140,4349653959,MayankJ1990,Mayank Jain,2015-12-02 10:44:29,,9,39,,162,False,,,No,NEGATIVE,0.9865105748176575
1253540140422660096,"If you could sacrifice one country to finish corona virus ,which one would it be and why india ?",2020-04-24 04:23:53,0,0,Twitter for Android,96,4499048783,sinan_meer,sinnaan,2015-12-16 04:07:23,"Indeed with hardship,will be ease",68,64,kashmir,85,False,,,No,NEGATIVE,0.9951127171516418
1253540137033588736,Success Stories of Corona Survivors: 93-year-old man becomes the oldest Indian to beat COVID-19. #IndiaFightsCorona… https://t.co/HqHuhvuuWN,2020-04-24 04:23:52,0,0,Twitter for Android,140,941013921443364864,GowdaManjulaB,@manjula Gowda bjp 🇮🇳🇮🇳,2017-12-13 18:36:16,"#Koi Road Par Na Nikle':.....🚩#फिर मुस्कुराएगा इंडिया......😀
 #फिर जीत जाएगा इंडिया......🚩",269,298,India,1988,False,,,No,POSITIVE,0.9111255407333374
1253540133699112960,"@JaneCaro So the door... to the classroom... opens a wormhole, in the space time continuum and teachers, SLSO’s and… https://t.co/bvjzCrysRY",2020-04-24 04:23:52,0,0,Twitter for iPhone,140,21712743,ozifrog,ozifrog,2009-02-24 00:35:29,"Aussie chick, writer, reader, lecturer, boxer, singer, bad ass mum.",37,173,,409,False,https://t.co/3g9bUVZV83,,Yes,POSITIVE,0.6831135749816895
1253540131014762496,"Koshys Group of Institutions Nursing Department, conducted an Interactive online session for students.

#India… https://t.co/AlGNemfzNS",2020-04-24 04:23:51,0,0,Twitter Web App,135,704928816196689924,KGIBangalore,KOSHYS GROUP OF INSTITUTIONS,2016-03-02 07:18:21,"Koshys Group of Institutions is one of the premier institutes for Management, IT & Health science located in Bangalore, India. #lifeatkgi",28,45,"Bengaluru, India",266,False,https://t.co/N0zbhknna6,,Yes,POSITIVE,0.9140900373458862
1253540130494853120,"Salute to front line corona warriors...
#IndiaFightsCorona https://t.co/Y2aFM6hpfb",2020-04-24 04:23:51,0,0,Twitter for Android,82,991985796277329920,harish_nss,HARISH NSS 🇮🇳,2018-05-03 10:20:18,"Social Activist, Writer & Poet, Governer Awardee, Deligates China and Bhutan, NSS National(IG) awardee ministry of youth affairs & sports Govt. of India.",88,303,Delhi NCR,363,False,,,No,NEGATIVE,0.823183536529541
1253540128464744454,Shit like this is why I don’t miss a corona briefing https://t.co/SGY04Ftk40,2020-04-24 04:23:50,0,0,Twitter for iPhone,76,457082051,jason_runion,jason runion,2012-01-07 00:43:46,Born tired IG- jason_Runion,293,262,Cincinnati,6777,False,,,No,POSITIVE,0.5790210366249084
1253540125172269058,Have yourself a few shots of disinfectant and you won’t care about anyone’s grades. You won’t even care if you got… https://t.co/ILCij9cus7,2020-04-24 04:23:50,0,0,Twitter for iPhone,139,855558623434596352,DraneBerisha1,Drane Berisha,2017-04-21 23:07:26,I'm a Daughter a Mom of a loving Son a Sister a proud Aunt. Love my Family and Friends. Love my work. I pray for non toxic medicine for all illnesses&ailments.,117,233,,2323,False,,,No,NEGATIVE,0.999478280544281
1253540124656312320,Let these aliens be mandatorily be tested in their countries and not dare venture into Uganda if not certified coro… https://t.co/1oPXaoIr4t,2020-04-24 04:23:50,0,0,Twitter for Android,140,357438946,martin_male,Martin Male,2011-08-18 11:07:46,A results' oriented project design and implementation specialist with proven ability to manage integrated resource intensive projects. Opinions shared are mine.,87,170,"Kampala, Uganda",523,False,,,No,NEGATIVE,0.9702482223510742
1253540121216978944,"China wants to rule the world by spreading corona , Read full news
#corona
#coronavirus
#china
#india
#poor
#world… https://t.co/0Eb05hJo7Z",2020-04-24 04:23:49,0,0,WordPress.com,139,1056164854879391744,Tezzbuzz1,Tezzbuzz,2018-10-27 12:44:58,"Tezzbuzz website is a website where you have all the information, what is going on around you. You will find them all on one platform.",36,5,Delhi,2703,False,,,No,NEGATIVE,0.99446702003479
1253540112669048832,@real_defender @realDonaldTrump Go ahead inject bleach and let us know if trump was right about it being a cure to corona virus,2020-04-24 04:23:47,0,0,Twitter for iPhone,127,864484951,creditedpuppet,Chris reynolds,2012-10-06 10:34:13,,2,9,,86,False,,,No,NEGATIVE,0.9906222224235535
1253540108671741952,I'm going to fuck the corona virus .. https://t.co/uc2PldDLp4,2020-04-24 04:23:46,0,0,Twitter for Android,61,709507514,Antivillainy,ネルダ,2012-07-21 20:11:56,| I don't believe in anything |,338,370,I'm a bum,9926,False,https://t.co/W5UE4Hrfuv,,Yes,NEGATIVE,0.9986103773117065
1253540107765919744,"#Japan #Nagasaki #Coronavirus

Among the crew members of a cruise ship in the repair dock in Japan, a further 43 pe… https://t.co/8ujYx36tQt",2020-04-24 04:23:45,0,0,Twitter for Android,140,1107367240154955777,Xy5Z89,Xy5Z89🇩🇪🇪🇺,2019-03-17 19:44:58,"A german 🇩🇪 , pro Europe 🇪🇺 and love for 🇮🇱. Against Racism and Antisemitisem. And reporting most quakes above 5.0 share news about all and actual Covid19",923,388,"Deutschland, EU ",35322,False,,,No,NEGATIVE,0.9930353760719299
1253540105480015872,"The president hinted at injecting Lysol to cure corona, JJ Redick mocked it, a rando said “who is this”? And a resp… https://t.co/p7n8I65KW5",2020-04-24 04:23:45,0,0,Twitter Web App,140,1132998066276065280,PhdDfs,"Justin B, PhD",2019-05-27 13:12:43,"I have a PhD in finance. I’ve also worked “real” investment jobs. I hate reductionist thinking, echo chambers, and willful ignorance. I like numbers and sports.",101,45,,1903,False,,,No,NEGATIVE,0.996039867401123
1253540104242696192,Trump got all the nigga remedies for corona EXCEPT a national lockdown😂,2020-04-24 04:23:45,0,0,Twitter for iPhone,71,797843669122449408,lilnumber4,Broke & Jiggy🧞,2016-11-13 16:48:48,Dont try to eat with me now if you couldn't starve with me then - KYLE,84,138,,666,False,https://t.co/pxxP36PBbS,,Yes,NEGATIVE,0.6547670364379883
1253540096374177793,MKU has taken a bold step to incorporate @TV47KE in their e learning programme. With corona e learning is becoming… https://t.co/IsAp26QV7V,2020-04-24 04:23:43,0,0,Twitter for Android,139,840790671019630592,martin_kimundia,MARTIN KIMUNDIA(032 MCA),2017-03-12 05:04:51,Fearless Mt kenya young politician!!!MCA NJORO 2022 and strong supporter of kikuyuism!!!,71,133,,87,False,,,No,POSITIVE,0.8239302635192871
1253540095476580353,"#God forgive us though we continue to sin.
#Whether manmade virus or not, it will never happened without the will o… https://t.co/wr2ooratkY",2020-04-24 04:23:43,0,0,Twitter for Android,140,2611736144,YakubuHalidu,Halidu Yakubu 🇬🇭,2014-07-08 14:09:42,Your decision determine your future.,136,197,Accra/Ghana,24551,False,,,No,POSITIVE,0.8473550081253052
1253540092603318272,@PawarSpeaks sir please ask Awhad saheb to shoftvin goverment Hospital for corona treatment . All citizens should b… https://t.co/yvsudhUyKP,2020-04-24 04:23:42,0,0,Twitter for iPhone,140,4239644668,JeetTraining,Jeet,2015-11-21 04:32:21,,77,53,,1572,False,,,No,NEGATIVE,0.9867820739746094
1253540087570198531,"@ACSCANSD Dear Friends, our immune system is very important because it helps us fight back diseases and I hope we c… https://t.co/hbqX1WBdXR",2020-04-24 04:23:41,0,0,Twitter for Android,140,996065541260427264,TOnggowasito,Tino Onggowasito,2018-05-14 16:31:45,Getting health in mind & body by pursuing love. 💖,83,86,"Jakarta Capital Region, Indone",6522,False,https://t.co/jNOFn2101r,,Yes,POSITIVE,0.9981679916381836
1253540086291009536,All liberals who are against should sign a document stating that should they get the corona virus they will not be… https://t.co/qNb8IZyif8,2020-04-24 04:23:40,0,0,Twitter for iPhone,139,1389446737,jmarker1612,❌ LIFE IS GREAT ❌,2013-04-29 12:51:41,"A great believer that the Clintons are responsible for the four deaths in Benghazi, and the recent Seth Rich murder #MAGA #PATRIOT #CONSERVATIVE",11508,11657,,14738,False,,,No,NEGATIVE,0.9955534338951111
1253540083724099587,Having corona genuinely hits you with a massive fucking reality check. It’s just setting in for me rn how possibly fucked I could be.,2020-04-24 04:23:40,0,0,Twitter for iPhone,133,824409341713383424,ggwen6936,gwen - longest offseason ever,2017-01-26 00:11:18,"Arsenal, Atletico, Boston Sports ——— @section10pod is the way to my heart ———Official Ossee Schreckongost fan account",212,777,"Bloomfield, NJ",4008,False,,,No,NEGATIVE,0.8789060711860657
1253540081371152384,"Since it’s corona pandemic , I’ll help people win, I’m going to be make a series of videos to show people how to Ge… https://t.co/hOdgosXuCy",2020-04-24 04:23:39,0,0,Twitter for iPhone,140,87890905,donnykonz,donny konz,2009-11-06 07:36:31,Rapper| video gamer|Known as Donny Konz Worked with major signed artist/ directors @sirthebaptist @famousdex @hireztherapper @cammeekins @_taylorbennett @empire,22903,9197,"Chicago, IL",21778,False,https://t.co/W3l7qB3kf4,,Yes,NEGATIVE,0.5204742550849915
1253540080154640385,Ramadan is the holiest month for Muslims from tomorrow. May Allah's mercy be showered on this month. I hope this mo… https://t.co/pLFJPMfKy5,2020-04-24 04:23:39,0,0,Twitter Web App,140,1252797180202479617,ShoaibFoyez,Shoaib Ahmed Foyez,2020-04-22 03:11:50,I’ve learned I don’t know anything.  Have also learned that people will pay for what I know.  Life is good.,2,0,,3,False,,,No,POSITIVE,0.5087313055992126
1253540077873094658,"@IngrahamAngle You looked better than I have ever seen you today, day 38 of Corona. Your hair looked awesome. Keep it that way!!",2020-04-24 04:23:38,0,0,Twitter for Android,128,54326522,MichaelPool,Michael Pool,2009-07-06 20:43:34,,7,108,,389,False,,,No,POSITIVE,0.9998207688331604
1253540075012571136,@catahoulasrule @POTUS Heat and solar energy kills corona....,2020-04-24 04:23:38,0,0,Twitter for iPhone,61,1214763357527576576,MichaelBroman1,Michael Broman,2020-01-08 04:19:02,Proud Patriot and US Marine Retired Federal Law Enforcement DOJ FBOP proud TRUMP supporter! I’ll follow back all Patriots! no DMs not here to date I’m married!,390,511,"Alexandria, LA",1355,False,,,No,NEGATIVE,0.9993224143981934
1253540075008393221,"Yesterday again few people are found corona positive in our locality. Day by day, condition is getting worst here i… https://t.co/2nYOqiIty5",2020-04-24 04:23:38,0,0,Twitter for Android,140,1251753262069493760,AlokKum52457923,Alok Kumar Gupta,2020-04-19 06:03:51,"science student
lives in howrah
🇮🇳🇮🇳",3,10,,4,False,,,No,NEGATIVE,0.9943735599517822
1253540074538631169,"this is terrible. the things that corona does.
also he is 26 so no... i aint even 19 yet",2020-04-24 04:23:38,0,0,Twitter for Android,88,1207003675144720384,ofthdreamss,lo,2019-12-17 18:24:45,#WILLEMDAFOE: can i be your pet woof woof,1,114,,117,False,,,No,NEGATIVE,0.9987723231315613
1253540074156892161,@DesertD14435761 @VickyLynnSulli1 @GOPChairwoman @DiamondandSilk @realDonaldTrump Love how people claim that the le… https://t.co/70XxF7dadD,2020-04-24 04:23:37,0,0,Twitter Web App,140,1165263587797061632,OhhSnap_ItsADR,OH Snap! Its Me!,2019-08-24 14:04:33,32 yrs Young. American and Latino.,72,376,,7926,False,,,No,POSITIVE,0.993290901184082
1253540070604357633,"@HassanAliJoho This is great preparedness and you should continue meeting everyday with your team to forestall, pre… https://t.co/1fV6Dxk0qo",2020-04-24 04:23:37,0,0,Twitter for Android,140,265898249,KichiaCollins,Kichia Collins,2011-03-14 09:32:29,"Mechanical Engineer specializing in flow systems, heat exchangers, Water/oil storage facilities construction/installation. To-date Oil Industry piping and tanks",243,294,"Kampala, Uganda",679,False,http://t.co/kayYVze6Nd,,Yes,POSITIVE,0.9984225034713745
1253540065944494085,"@soledadobrien Imagine an IV filled with spic and span disinfectant 

Imagine bolts of ultraviolet light that can p… https://t.co/D1BpqxG6bQ",2020-04-24 04:23:36,0,0,Twitter for Android,140,1225485979621974028,BillieBlvd,BLVDBillie,2020-02-06 18:26:53,urban intellectual cigar smoking vegan,5,105,,911,False,,,No,NEGATIVE,0.9914078116416931
1253540063264169984,"HUGE MEDICAL PRODUCT JUNK FROM CHINA TRADED IN DELHI BY ILLITERATE,GREEDY TRADERS.
STINKING MASKS, DEFECTIVE IR THE… https://t.co/t4h8MiFblU",2020-04-24 04:23:35,0,0,Twitter for Android,140,1042103597155188736,DineshMendiratt,D K Mendiratta,2018-09-18 17:30:33,"ELDERLY CARE SOLUTIONS INTEGRATOR , SOCIAL & FUNDAMENTAL RIGHTS ACTIVIST. RT not endorsement

FOUNDER- VFRD - FUNDAMENTAL DUTIES 

🇮🇳 NATIONALIST ABOVE ALL",94,332,"India, Planet Earth",9911,False,,,No,NEGATIVE,0.9996640682220459
1253540062450479105,@PhyllisLevin1 @B52Malmet They’re counting on Corona.... just saying.,2020-04-24 04:23:35,0,0,Twitter for iPhone,69,4847512112,val_kudirka,Val kudirka,2016-02-02 03:51:48,"Political Refugee from Brooklyn, Heathen, the person your GOP momma warned you about. No MAGAts, No GOPers, No RWNJs, No Shit! #Resist",1163,1077,"Portland, OR",26867,False,,,No,NEGATIVE,0.94068843126297
1253540062094151680,Scary ass. Like this Corona shit really opened my eyes to how many ppl I had around me that was bitch made G::..🤦🏽‍♀️,2020-04-24 04:23:35,0,0,Twitter for iPhone,117,91972711,MrzKookie,ThëGatëKëëpër⚫️✨,2009-11-23 09:37:41,I tried to be normal once...worst two mins of my life::. #WiseWoman🔮  #Flowerchild🌷#SupremeBeing🔱 #PiscesSun🌞     #PiscesMoon🌚,1453,1181,Chicago #ESC,46182,False,,,No,POSITIVE,0.9908159971237183
1253540054288535560,"Now you are even a morning person, kyoka corona https://t.co/fgVs3h32sI",2020-04-24 04:23:33,0,0,Twitter for Android,71,511349918,TheAldoGuy,The Aldo Guy ™,2012-03-02 04:23:54,I see opportunities where you see obstacles. || Liverpool FC || Reggae music || Digital media & marketing.,1769,1321,Uganda,18882,False,,,No,NEGATIVE,0.9617840051651001
1253540051977265154,"Stigmabase | HIV — To tackle the corona crisis, enable and bring together innovative research on a common ...: Back… https://t.co/pheClBdGVk",2020-04-24 04:23:32,0,0,dlvr.it,140,191092262,pairsonnalitesN,Stigmabase | NORDIC,2010-09-15 15:55:47,Ireland — Scotland — Inuit —  Svenska — Русский | Keeping up-to-date on global exclusion — Stigmabase is an internet non-profit Initiative,1480,1340,Ireland | Scotland | Inuit | Россия | Skandinavien,762999,False,https://t.co/NCUaHQjw1A,,Yes,POSITIVE,0.9356178045272827
1253540044201172992,@hvbisperm @Crimson_CG @Osusannahh1 @HITSDD @BTS_twt We don’t care because we do t want your corona virus,2020-04-24 04:23:30,0,0,Twitter for iPhone,105,165075488,joosemadic,Lord Farquaad 👑🇩🇴,2010-07-10 14:40:11,IG:@FigAuraToys,1466,1383,Just flew in from Stupidtown ,31228,False,,,No,NEGATIVE,0.9989468455314636
1253540044125528066,"@BigDaddyCaddy3 @GingerCorrine69 Dear Friends, our immune system is very important because it helps us fight back d… https://t.co/pe7nS9j4TI",2020-04-24 04:23:30,0,0,Twitter for Android,140,996065541260427264,TOnggowasito,Tino Onggowasito,2018-05-14 16:31:45,Getting health in mind & body by pursuing love. 💖,83,86,"Jakarta Capital Region, Indone",6523,False,https://t.co/jNOFn2101r,,Yes,POSITIVE,0.9972175359725952
1253540042619969537,"Corona Virus is a Democide https://t.co/fQ166RmPsF via @YouTube
This was just posted sharing for it has been planned, listen for yourself",2020-04-24 04:23:30,0,0,Twitter for iPad,137,1083511074132017152,BarbaraPride7,Barbara Pride,2019-01-10 23:49:05,,40,57,"Marathon ,Ohip",571,False,,,No,NEGATIVE,0.998421311378479
1253540041462349825,Success Stories of Corona Survivors: 93-year-old man becomes the oldest Indian to beat COVID-19. #IndiaFightsCorona,2020-04-24 04:23:30,0,0,Twitter for Android,115,1252293261244289025,MANISHJ46830999,MANISH JAISWAL,2020-04-20 17:49:45,Mr Cool,2,93,"Assam, India",3,False,,,No,POSITIVE,0.9979314804077148
1253540038639366145,"@ANI 349 cases in byculla till 21.4.2020 and this is how maha gov doing work in maharashtra to fight against corona virus
😭😭😭😭😭😭",2020-04-24 04:23:29,0,0,Twitter for Android,128,63170170,Bahubali_Hindu,आनंद वर्मा,2009-08-05 15:55:59,Jay Shree Ram || Proud Nationalist || Namo Bhakt || Bharat Mata Ki Jay ||,1473,587,India,30430,False,,,No,POSITIVE,0.50543212890625
1253540034680102918,"Soon times, back on track once corona is done ✅ https://t.co/BmFUIHgsnJ",2020-04-24 04:23:28,0,0,Twitter for iPhone,71,1544476716,iiimxo,m,2013-06-25 01:29:13,❤️ & ☀️ r,1023,711,,6679,False,,,No,NEGATIVE,0.9902412295341492
1253540030687125504,"UP TILL  NOW 
NO.  REMEDY  FOR  CORONA virus",2020-04-24 04:23:27,0,0,Twitter for Android,44,1221895040219389953,mohamednaguibf1,mohamednaguibfayiad,2020-01-27 20:39:47,من  كان  يريد  العزة  فلله العزة  جميعا. إليه  يصعد الكلم  الطيب   والعمل  الصالح يرفعه,19,280,,163,False,,,No,NEGATIVE,0.983958899974823
1253540029932212224,"I’m down to do a Covid-19 challenge. If you’re a b-ball player, we can do a 1v1. Every game you win : I’ll donate t… https://t.co/Nw9ucyOZk0",2020-04-24 04:23:27,0,0,Twitter for iPhone,140,352167193,DarrinOc,darrin,2011-08-10 07:15:08,"There's no obstacles. Well, there are tons of them, but there are none",127,374,"Plantation, FL",6376,False,,,No,NEGATIVE,0.9731070399284363
1253540022839541761,@IPSMadhurVerma @soniandtv Salute the corona warriors,2020-04-24 04:23:25,0,0,Twitter for Android,53,83359241,dhountli,Anil Anand,2009-10-18 13:00:52,"Journalist, specializing in internal security and political indian subcontinent with focus on Kashmir.Sports enthusiast with modeling as a hobby.",1206,512,New Delhi,12164,False,,,No,POSITIVE,0.7851160764694214
1253540022382284800,@UrmileshJ It seems that center wants the  chapter of Corona disease2 continue for several months so that all serio… https://t.co/oA0vuuKYPN,2020-04-24 04:23:25,0,0,Twitter for Android,140,463746701,rajbodhkaul,rajbodhkaul,2012-01-14 12:39:51,"RBKaul, Working President- Vishwa Bauddha Sangh ,Chairman-Bodh Research Council,Chairman-Lord Buddha Global Foundation",769,898,Delhi,6194,False,,,No,NEGATIVE,0.9980810880661011
1253540020012670977,@burnie Last time you came out with a tweet like this was right before the Corona virus started getting exceptional… https://t.co/zlCmpxsdNQ,2020-04-24 04:23:25,0,0,Twitter for Android,140,1102043490,EVApilot011,Tymothy Henry,2013-01-18 21:22:31,"Inventor, smart-ass, friend, gamer, I do things to make myself laugh and hope others laugh as well.",20,319,,1603,False,,,No,NEGATIVE,0.9919888377189636
1253540016204079104,"Just missed my package bcs I was listening to a Melanie Martinez song, the guys probably has Corona she saved me omg 🥺",2020-04-24 04:23:24,0,0,Twitter for iPhone,118,1018511101053448192,FarrelDharma,I'm a LDR stan,2018-07-15 15:02:24,I want to let you know I have 18+ content here don't be surprised,76,97,"West Java, Indonesia",2754,False,,,No,NEGATIVE,0.9994779229164124
1253540013180096513,"@jdhankhar1 @MamataOfficial Sir, we r already reeling from corona crisis and lockdown in place everywhere. So meanw… https://t.co/Z9a7uErZpH",2020-04-24 04:23:23,0,0,Twitter for Android,140,156560121,Vagabondlala,Kesab Lala,2010-06-17 07:37:56,Brief case,52,642,"Chennai, Mittanamalli",3385,False,,,No,NEGATIVE,0.9959744811058044
1253540009921183745,@MarleneDuque2 for the warm or for the defence corona? 😎,2020-04-24 04:23:22,0,0,Twitter Web App,56,1013103177414082560,Cr1sJiron,Cristhiam Jirón,2018-06-30 16:53:14,"Periodista amante de los libros, deportes, senderismo, el gym y las bicicletas. Trato de vivir apasionadamente la •única e irrepetible• vida que tengo.",671,69,Guatemala,1376,False,,,No,NEGATIVE,0.9751672148704529
1253540009384251393,NY Times Finally Pushes Back A Little Against Chinese Communist Corona Propaganda https://t.co/TH3dY8CokJ https://t.co/uMJMb4Ki53,2020-04-24 04:23:22,0,0,WordPress.com,129,14326618,GOMP,Al - Grumpy Old Man,2008-04-07 20:29:00,Grumpy Old Man,172,128,PA USA,18504,False,http://t.co/LyT05TlETu,,Yes,POSITIVE,0.7153072357177734
1253540005638782981,Tom Hanks writes to boy called Corona who said he was bullied https://t.co/RQY3B5dFc6 https://t.co/xknzoEqdUD,2020-04-24 04:23:21,0,0,Twibble.io,109,65109514,globalissuesweb,Global Issues Web,2009-08-12 18:07:19,"Forum on Global Issues, Geography,  and Culture. In  the interests of economic justice, sustainable development and universal human welfare.",28065,2089,"Greater Portland, Oregon, USA",937102,False,https://t.co/2puX55ZoQT,,Yes,NEGATIVE,0.98896324634552
1253539994859233280,@tribelaw I hope you get the corona virus and DIE BITCH,2020-04-24 04:23:19,0,0,Twitter Web App,55,3058843380,AMsupp,A Suppner,2015-03-03 00:35:58,retired Navy,24,116,"Renton, WA",4951,False,,,No,NEGATIVE,0.9947260022163391
1253539993709973505,"Tom Hanks pens heartfelt letter to bullied Australian boy named Corona https://t.co/ww83kA7bRK 
Fantastic Tom..and… https://t.co/fvmMdG351c",2020-04-24 04:23:18,0,0,Twitter Web App,139,4362303858,ReaRoborgh,REA Roborgh,2015-11-26 03:03:01,,2,44,,42,False,,,No,POSITIVE,0.9946139454841614
1253539992447541250,"nurse &amp; PT came to house within 30 min. of arriving home, we were masked, they were masked &amp; face shields with glov… https://t.co/VqMTzB4HDN",2020-04-24 04:23:18,0,0,Twitter Web App,148,700293308,MurphyLaw23,MurphyLaw Ph.D,2012-07-17 03:38:36,#PatriotsUnited #righttolife #MATRIX #WWG1WGA #Cult45 #ProjectLookingGlass 🦅🐸🔍👀🔎🇺🇸🇬🇧👁‍🗨,2238,2199,,89479,False,,,No,NEGATIVE,0.9932067394256592
1253539983492874241,@AsiwajuTinubu H.E with due respect i just want to inform you i get the medicine of Corona virus. If anybody need i… https://t.co/16NqFEscQv,2020-04-24 04:23:16,0,0,Twitter for Android,140,1252327634970783751,SadiqMamman5,Malkach2020,2020-04-20 20:06:13,Am man of peace,10,56,,22,False,,,No,POSITIVE,0.9446906447410583
1253539982628859905,"President Dennis Trump will HUMILIATE the corona virus, you’ll see!",2020-04-24 04:23:16,0,1,Twitter for iPhone,67,596897267,seanlitwin,Sean “ShoeSean” Litwin VII,2012-06-01 23:32:47,biology student || shoe guru (the “shoe sean”) ||,116,256,"Minneapolis, MN",1880,False,,,No,POSITIVE,0.9967741370201111
1253539974969884673,making myself think i have corona aha ha gang gang,2020-04-24 04:23:14,0,0,Twitter for iPhone,50,1242581061567000576,dumbbspliffs,Hunter,2020-03-24 22:36:43,,22,48,,66,False,,,No,NEGATIVE,0.9926667809486389
1253539969404108800,Corona virus is the biggest cock block no cap,2020-04-24 04:23:13,0,0,Twitter for iPhone,45,1057762359769423872,baros_josh,Josh Baros,2018-10-31 22:32:53,,280,108,"Albuquerque, NM",229,False,,,No,NEGATIVE,0.9969902038574219
1253539969303527425,Imagine on the same night President Trump tells people to inject household cleaners into their body to fight corona… https://t.co/3e9xTm10Hw,2020-04-24 04:23:12,0,0,Twitter for iPhone,140,1096161111202779136,whyyasss,Yasmine ❤️,2019-02-14 21:35:49,"25 . BA in Sociology . MA in Interdisciplinary Studies, Public Health and Public Administration . MPH candidate . Living on the island of misfit black girls ❤️",49,169,"Raleigh, NC",513,False,,,No,NEGATIVE,0.9914034008979797
1253539968221208576,@Rigo_Corona @safeinsolitude Lmao scary either way,2020-04-24 04:23:12,0,0,Twitter for iPhone,50,16506565,MikelJoshua,Mikel Joshua,2008-09-29 02:39:30,"My tweets aren't for everyone, it takes a special kind of asshole to like them. #NoHoleNoFollow",6154,431,"Las Vegas, NV",98120,False,https://t.co/6ALrDilktH,,Yes,NEGATIVE,0.9879634380340576
1253539959128162305,I'm saying it now in public. When this corona stuff is all over i'm going to do an open mic stand up set,2020-04-24 04:23:10,0,0,Twitter Web App,104,85825691,marcodupa,Maui Mallard,2009-10-28 14:11:53,"Hello Twitter World it’s Yours Truly. if you don’t see it here, I didn’t say it",208,633,"Orlando,Fl",6852,False,https://t.co/EN9vwPNToK,,Yes,NEGATIVE,0.992243230342865
1253539947442733058,Is corona ever gonna end? 🙂🙂🙂,2020-04-24 04:23:07,0,3,Twitter for iPhone,29,805482407600254976,DilDiyaGallan,CYNTHIA🌟,2016-12-04 18:42:25,SidNaaz fan toh bilkul Nehi hu. Nehi hu. Nehi hu.,1006,161,United States,3565,False,https://t.co/tagzcCMjVx,,Yes,NEGATIVE,0.9909480214118958
