id,text,created_at,retweet_count,favorite_count,source,length,user_id,user_screen_name,user_name,user_created_at,user_description,user_followers_count,user_friends_count,user_location,user_statuses_count,user_verified,user_url,number_of_QuestionMarks,user_has_url?,label,score
1257731829299326977,They saying organ failure a side effect of Corona https://t.co/Tx9re63kMU,2020-05-05 18:00:10,1,0,Twitter for iPhone,73,916767092636028928,BillLAMEbeer,Tweet Forrest Tweet,2017-10-07 20:48:02,"talkin’ all them good thangs, that’s all I’m really good for. Portland, OR➡️Carrollton, GA #RIPCITYONTHEYASS",330,129,,80608,False,,,No,NEGATIVE,0.9996347427368164
1257731826702880769,Today 4nos new Corona positive found in Ranchi,2020-05-05 18:00:09,0,0,Twitter Web App,46,899978372889038849,NatrajKanhaiya,KANHAIYA NATRAJ,2017-08-22 12:55:39,,5,68,,67,False,,,No,POSITIVE,0.9352731704711914
1257731824593354758,"Bs Yeh Corona Or Lockdown Khtm Ho Jay Fir Mazy He Mazy Hain...!😎🤟🏻🔥

EXAMS: https://t.co/2bzIjoT7VE",2020-05-05 18:00:09,0,1,Twitter for Android,99,1252290089956376583,NoorUlA18471171,Noor Ul Ain Janjua ♥️,2020-04-20 17:37:40,Main Hun...Or Mery Sath Bhi Main Hun...!♥️👉🏻💫,10,13,,20,False,,,No,NEGATIVE,0.9976968169212341
1257731822710128641,@Shifframarvins1 With this corona?,2020-05-05 18:00:08,0,0,Twitter for Android,34,1245219729347883008,iheart_stella,Iheart Stella,2020-04-01 05:22:04,Jesus my redeemer 💖💖💖❤,26,146,,11,False,,,No,NEGATIVE,0.9816412925720215
1257731819480457219,Don't know if this is legal. Had me distracted for a bit. But kinda cool. Especially the Corona Premium. Is it frid… https://t.co/DAsSMFHam6,2020-05-05 18:00:07,0,0,Twitter for Android,140,1249388766650937348,JavierValdezJ11,Javier Valdez Jr,2020-04-12 17:28:06,"Love the outdoors. Crazy sport fanatic. Like gambling. Live music is the best  Big Texas fan like all Texan teams. Cowboys, Spurs, and Astros my top teams.",0,1,,2,False,,,No,POSITIVE,0.9865167140960693
1257731814300450816,"📣 New Podcast! ""You Just Said You Were Damn Near Married"" on @Spreaker #blacklivesmatter #blackmen #blackpodcast… https://t.co/WyRzRzB2xz",2020-05-05 18:00:06,0,0,Spreaker,137,968187002821791745,EVYDBlackMen,Everyday BlackMen,2018-02-26 18:12:24,A podcast for black men. We are available on every streaming platform. Check the link on our website. #WakandaForever,66,87,ATL-hoe!,1859,False,https://t.co/fegGqrQVMh,,Yes,NEGATIVE,0.9898595213890076
1257731814296367104,"@AndiMakinana @BusinessLiveSA During this time of corona, yes I agree. We in a junk and we need to save jobs.",2020-05-05 18:00:06,0,0,Twitter for Android,109,1181364837525413888,Humphre75221246,Humphrey,2019-10-08 00:25:34,,368,625,"England, United Kingdom",2252,False,,,No,NEGATIVE,0.9962459206581116
1257731810445766657,Ayee I heard my boy parlay got corona @iamdesibanks,2020-05-05 18:00:05,0,0,Twitter for iPhone,51,2187703572,tsak375,Saint•Laurent•Papi🕊,2013-11-11 04:50:59,Follow my back up acc: @SakyiTerrence VA🛫BayArea🌴,792,584,Terrence’s 🌎,16339,False,,,No,NEGATIVE,0.6644302010536194
1257731809053458433,Yes even Corona virus will be eradicated if we all seek our God on knees https://t.co/dMUB2sFHFr,2020-05-05 18:00:05,0,0,Twitter for iPhone,96,883057829220950016,charles_magara,Charles Magara,2017-07-06 20:19:27,Jolly,135,149,"Nairobi, Kenya",15692,False,,,No,NEGATIVE,0.9848485589027405
1257731807044239360,"Latest updates of COVID-19 in India 🇮🇳.

-------------------------------
😲Total Cases: 46711 [+278]
💉Active Cases:… https://t.co/tw2GdqdQLr",2020-05-05 18:00:04,0,0,GoCoronaBot,139,722421316859486209,GoCoronaBot,GoCoronaBot,2016-04-19 13:47:18,"I am a bot that tweets the latest coronavirus stats in India🇮🇳.
Source: https://t.co/IxO40dUQL2.
I tweet data every ~6 hours.",744,1,India,190,False,https://t.co/P825IrvVDG,,Yes,NEGATIVE,0.9828749895095825
1257731806838902788,6/6 an increase in the temperature by a few degrees that could lead to radiation-related issues that would be much… https://t.co/jrSFpfL435,2020-05-05 18:00:04,0,0,Twitter Web App,139,1248632942836006913,lunchwale,LUNCHWALE,2020-04-10 15:24:42,,0,0,,30,False,,,No,NEGATIVE,0.9921351671218872
1257731801545654273,"@JonJohnstone4 @DrJudyAMikovits @patrickbetdavid @this_vid Go on you tube, type in Andreas Kalker interview-CDS, Co… https://t.co/03797zI54A",2020-05-05 18:00:03,0,0,Twitter Web App,140,762299185899114496,Achilles12219,chris obrien,2016-08-07 14:47:43,,21,11,,747,False,,,No,NEGATIVE,0.9949316382408142
1257731800992034816,"In Sweden we have compulsory military service, in US you have... 🤔 not sure?
What are they going to do... a (HSSOUM… https://t.co/ViiYWVuB1o",2020-05-05 18:00:03,0,0,Twitter for Android,140,626808348,jhnhellstrom,Johan Hellström,2012-07-04 19:42:03,ACSM EP-C Sport Physiologist®,127,231,Sweden,907,False,,,No,NEGATIVE,0.9980402588844299
1257731800874602507,To rid your body of the corona https://t.co/vQwz0yUefC,2020-05-05 18:00:03,0,1,Twitter for iPhone,54,35425860,EJ_Santana,sᴀɴᴛᴀɴᴀ 𓅓,2009-04-26 07:28:47,𝐀𝐋𝐋 𝐓𝐇𝐄 𝐃𝐄𝐌𝐎𝐍𝐒 𝐋𝐎𝐎𝐊𝐈𝐍 𝐌𝐎𝐎𝐃𝐘,3022,4893,"Chicago, IL",54518,False,,,No,NEGATIVE,0.9945709109306335
1257731799851110400,📺 Live with Littlewood 📺 Tomorrow at 6pm we're welcoming some of Westminster's finest to our live-streamed discussi… https://t.co/Yr35RTy4Ig,2020-05-05 18:00:03,1,0,Buffer,140,57602189,iealondon,IEA,2009-07-17 09:43:58,"The UK's original free-market think-tank, founded in 1955. No corporate view - sharing material from wide-ranging list of spokespeople.",41252,357,Westminster,27251,True,http://t.co/AKHGLiLRdw,,Yes,POSITIVE,0.9991963505744934
1257731798236356611,"**ALERT** New Jersey Covid19 News
130,593 total positive cases
2,324 new cases
8,244 total deaths
334 new deaths… https://t.co/HXHdiohaiK",2020-05-05 18:00:02,0,0,covid19oceanupdate,137,1240446320252522503,Covid19Ocean,New Jersey Covid19,2020-03-19 01:13:50,Updating every hour with live statistics from NEW JERSEY! Last Update: 05/05/2020 1:02 PM,56,1,"New Jersey, USA",557,False,,,No,NEGATIVE,0.9242700934410095
1257731797603024898,"@UN 
1/6 Point to ponder!
While the whole world is fighting hard to stop the spread of the deadly Corona pandemic a… https://t.co/2wWVZEHVCV",2020-05-05 18:00:02,0,0,Twitter Web App,140,1248632942836006913,lunchwale,LUNCHWALE,2020-04-10 15:24:42,,0,0,,30,False,,,No,POSITIVE,0.5181799530982971
1257731795900141569,"@ProjectLincoln @realDonaldTrump Wow, what a lousy scripted Democrat talking point. Do you people really believe th… https://t.co/0RizSVdCLj",2020-05-05 18:00:02,0,0,Twitter for iPhone,140,15047886,ChoppersLounge,Rob Chopper,2008-06-08 16:48:46,❤️🇺🇸🇮🇱#Dad #Independent #Christian #CONSERVATIVE ⚓️#USNAVY #VETERAN #MAGA #PATRIOT #CodeofVets #Paramedic 🚑🎸#WWG1WGA LOVE WINS Join Me @clouthub,20730,22578,USA,15057,False,,,No,NEGATIVE,0.9985847473144531
1257731795371556864,Will they ever let us back outside? Find out on the next episode of Corona watch.,2020-05-05 18:00:02,0,0,Twitter for iPhone,81,259479809,smokeypit,mila.akilah,2011-03-02 00:29:22,Aye I dont use this often,114,99,Nirvana ,1143,False,,,No,NEGATIVE,0.9919410943984985
1257731794821976064,"#THANKUISRAEL
Finally Israel made vaccine of Corona virus and officially announced by Israel govt. Today..thanks a… https://t.co/SgRVyMPtGB",2020-05-05 18:00:02,1,1,Twitter for Android,139,1240712615082332160,RashminderSin17,Rashminder Singh,2020-03-19 18:52:05,Bitcoin,1,10,,23,False,,,No,POSITIVE,0.9965645670890808
1257731794452938758,@ArvindKejriwal Sri I had already wrote to you that in a Sri Nagar Colony where No social distancing is maintaining… https://t.co/3lzItOPpB6,2020-05-05 18:00:01,0,0,Twitter Web App,140,600847844,naveenk54259314,Rishi,2012-06-06 10:07:40,,18,330,,20,False,,,No,NEGATIVE,0.9831453561782837
1257731792775200768,"Do you want to be well prepared for the restart of the soccer competition?
Check out https://t.co/wciMiWHdTe NOW!.… https://t.co/JmEH7P3UUt",2020-05-05 18:00:01,1,2,TweetDeck,139,969991939146870784,Sjnoeff,Rick,2018-03-03 17:44:34,,15,83,,552,False,,,No,NEGATIVE,0.9963357448577881
1257731791860817924,"Take a tour @ online anti-corona exhibition #StPetersburg

#COVID19 #coronavirus https://t.co/G0OnrGvK2v",2020-05-05 18:00:01,4,2,Twitter Media Studio,104,64643056,RT_com,RT,2009-08-11 06:12:45,"RT, the global news network, broadcasts from Moscow, London, Paris and Washington studios to over 100 countries.",3076753,547,,343875,True,http://t.co/bDDyvy9DmR,,Yes,NEGATIVE,0.9923492670059204
1257731791542276096,"Creative Young Artists are Bringing Compassion, Friendship and Kindness to our Planet Earth
Please Help Retweet… https://t.co/ZX76f3vpDN",2020-05-05 18:00:01,0,0,TweetDeck,136,83219923,ServEarth,Peaceful Friend,2009-10-17 21:06:08,"I  hope to Serve Mother Earth and All Of Humanity. 
I would really appreciate it if you would kindly Retweet My Peace Tweets Occasionally. Thanks and Peace",5082,5804,California,2971,False,http://t.co/yIBG6AN1Eo,,Yes,POSITIVE,0.9962298274040222
1257731785229774849,@_Doraa18 ironically...Corona is a mexican beer 😂😭😭😭,2020-05-05 17:59:59,0,0,Twitter for iPhone,52,1959036108,Seanjeann,Big Baby J ❄️,2013-10-13 17:03:14,I’m trolling in 80% of my tweets but i’m dead serious on my blog. Read It 💯🇷🇼,361,422,my ends,33208,False,https://t.co/wrFlwvWlPf,,Yes,NEGATIVE,0.9911030530929565
1257731784571117568,"@KeithMarsh_ Corona free &amp; Sucka free, playa",2020-05-05 17:59:59,0,0,Twitter for iPhone,48,163287872,ENDtro,Johnny,2010-07-06 01:25:42,25 ⚡️ Music ⚡️ Old Soul ⚡️Lonesome on the Trail,529,424,,90825,False,https://t.co/HVNfruOLbV,,Yes,NEGATIVE,0.9953699707984924
1257731782058758147,@taekehf @pina2345 @erikmouthaanRTL Actually it didn’t. As I said your country is still in the top worst corona cou… https://t.co/FfpdP37L1r,2020-05-05 17:59:59,0,0,Twitter for iPhone,140,202038553,Mawufeasi,Mawufeasi,2010-10-13 04:52:45,Born in Ghana. College in the US (UCLA)and proud citizen 🇺🇸. 22 years married with the most beautiful Dutch Surinam girl ever. Conservative Libertarian.,657,823,"San Diego, CA",39132,False,https://t.co/zJXbYWFrEk,,Yes,NEGATIVE,0.9995250701904297
1257731780582543362,Guy told me his grandpa just died of corona. I said “Are you okay?” I hate 💕🧚💫✨🌺myself. https://t.co/W1DoGvvufa,2020-05-05 17:59:58,0,0,Twitter for iPhone,111,2244171825,lbstrodel,Levi Strodel,2013-12-26 03:10:23,"not the gay you want, but the gay you deserve.",32,293,"Winter Springs, FL",235,False,,,No,NEGATIVE,0.9961632490158081
1257731777914908672,Big mad that cinco de Mayo is canceled over a virus named corona,2020-05-05 17:59:58,0,0,Twitter for iPhone,64,4164689052,SassyBrookeP,Sassy.,2015-11-08 05:14:07,"I'm not where I want to be, but thank God I'm not where I use to be. 💑✈️🐶💄",143,135,,5903,False,,,No,NEGATIVE,0.9986661672592163
1257731772965625857,@jaavedjaaferi Kerala is spear heading the corona fight.. Kudos to them.,2020-05-05 17:59:56,0,0,Twitter for Android,72,70143611,whitecrescent,Hameed Pasha حمیدپاشا,2009-08-30 15:36:48,"Doc by Destiny, #Sufi by Choice. Takes pride in being an Indian, not a namesake 'Nationalist' #World Affairs #Fitness #Aviation Geek 🛫🛩🛫🛩",360,265,Saare Jahan Se Achha Hindustan,26960,False,,,No,POSITIVE,0.9804586172103882
1257731771627646979,are there still sales on corona? is that what we're doing tonight? 🍺,2020-05-05 17:59:56,0,0,Twitter Web App,68,91858660,_machinic_,Lindsey,2009-11-22 20:10:22,arcana durham / ncsu / duke u / black study / femme feminism / hysterical criticism / literature / art / science studies / medical humanities / cocktails,457,743,"Durham, NC",10176,False,,,No,NEGATIVE,0.9953952431678772
1257731770398760965,As much as I believe accountability is needed in the post-corona era to avoid another global shutdown from happenin… https://t.co/8hBAQsJVOd,2020-05-05 17:59:56,0,2,Twitter for iPhone,140,1125293462,GheZinou,G.Zine,2013-01-27 15:00:46,"#Algeria-n. Alumni @AUB_Lebanon/@USMEPI & @TheNESACenter. Contribute @FikraForum hosted on @WashInstitute. Focus on #MENA region's political, security issues.",1869,596,Lebanon/Algeria,12569,False,https://t.co/gBHUc4EUeU,,Yes,NEGATIVE,0.9565165638923645
1257731764371574790,"@AirdaleMcpo @SenSchumer Our death toll topped 70,000 ""winners"" today.

All hail Lord Donald, the ""Corona King!"" https://t.co/VTYS98jfkv",2020-05-05 17:59:54,0,0,Twitter for Android,136,1231335132134592514,LPundy,wee chica,2020-02-22 21:49:55,A new account as I'm another voice that keeps getting kicked off Twitter. favoritism is rife on Twitter.,3,120,All Over,810,False,,,No,POSITIVE,0.9234625101089478
1257731759183212545,"Dis corona ting yah a real fuqry enuh

Imagine ppl owe mi &amp; a walk pass mi inna mask &amp; mi nuh kno a dem 🤦‍♂️",2020-05-05 17:59:53,2,1,Twitter for Android,116,149787793,Don_Royal40,Don Royal,2010-05-30 06:35:00,I rep England,183,162,Somewhere in Austrailia ,8056,False,,,No,NEGATIVE,0.993178129196167
1257731757689851909,"@ThiagoBruce5 Yes,,a u ready to die  v Corona buh give me a hug",2020-05-05 17:59:53,0,0,Twitter for Android,63,1212433185033748480,nat_rickie,Rickie Nat,2020-01-01 18:00:08,,870,478,,3682,False,,,No,POSITIVE,0.9945096373558044
1257731754250645504,@Corona_moronaaa Hi!Hire professional writers.Kindly dm,2020-05-05 17:59:52,0,0,Twitter for Android,55,307431361,AcademiaproPro,Academic pro,2011-05-29 16:36:12,"Best writer based in the US. 🇺🇸
DM for essays/assignments/homework/research/online class help;PayPal & Cashapp. academicguru20@gmail.com/+19179638654",7121,6293,New York,22693,False,,,No,NEGATIVE,0.9543949961662292
1257731753051131905,"@PoliticalDi She should rest in peace RIP
Outside is corona epidemic
#COVIDー19 
#IndianDaughterSafoora",2020-05-05 17:59:52,0,0,Twitter for Android,102,1220891149650612226,gulia2183,SohamGulia2183,2020-01-25 02:08:52,Jai shri ram🙏,107,346,,6019,False,,,No,NEGATIVE,0.9740337133407593
1257731751570440192,Just seen someone on the telly who’s had corona and isnt dead!!  Why is this,2020-05-05 17:59:51,0,0,Twitter for iPhone,76,1061755010206351360,jontylad91,Jonathan Hopkinson,2018-11-11 22:58:15,Stupid Person,47,123,"Wirksworth, England",58,False,,,No,NEGATIVE,0.9982403516769409
1257731749846626309,@zeeshan_iyc @AUThackeray @AslamShaikh_MLA @KishoriPednekar @mlaAminPatel If government can come up with a solution… https://t.co/WT9lNNpAOI,2020-05-05 17:59:51,1,1,Twitter for Android,140,4789027093,SagarBhutada10,Sagar Bhutada,2016-01-20 14:04:19,Chartered Accountant | Investment Consultant | Passionate to work with entrepreneurs launching innovative businesses (creating long-lasting impact),38,526,Pune,470,False,,,No,NEGATIVE,0.9927639365196228
1257731746193342465,My Landlord Don’t Give A Fuck About CORONA😩 Bitch Ass Nigga Emailed Me Today Like RENT 🏡 or TENT 🏕🤦🏽‍♀️🤣,2020-05-05 17:59:50,0,0,Twitter for iPhone,104,39824579,Thick_Goddess_,♧TheGoddess♧,2009-05-13 20:20:46,"GODfidence🙏🏾✨. {April 24, 2018}🎀👣 Know your worth, Then add tax to it👸🏾🖤",546,1058,- Loyalty Over Royalty  ✔,6554,False,,,No,NEGATIVE,0.9928328990936279
1257731746151272449,@JalapathyG Corona is contagious!! Hygiene is the key since tiffin centers doesn't clean plates with disinfectant!!,2020-05-05 17:59:50,0,0,Twitter for Android,115,2315867358,Jambalahaatraja,Varun Kaipa,2014-01-28 17:59:22,"freelance Healthcare professional with 10+ years experience in Revenue cycle management
#TDPTWITTER",67,371,"Hyderabad, India",3081,False,,,No,NEGATIVE,0.9904608130455017
1257731745564241920,"@JoeConchaTV Lockdown may teach people to spend even more irresponsibly than they have historically.

At some point… https://t.co/wreCyM35Sr",2020-05-05 17:59:50,0,0,Twitter Web App,140,1072307352198676485,MuddleAlong,MuddleAlong,2018-12-11 01:49:30,,10,38,,1339,False,,,No,NEGATIVE,0.9963895678520203
1257731744851062785,@Shatrubhanja When I came home it was Dasha Mata Pujan and women there were referring to corona as corona mata,2020-05-05 17:59:50,0,1,Twitter for Android,110,1134486370557317120,ayudha_h,bhagvankusumAyudhaH,2019-05-31 15:46:43,Hindu nationalist,363,361,"Abu Dhabi, United Arab Emirate",9715,False,https://t.co/vMYoNosoiI,,Yes,NEGATIVE,0.974908173084259
1257731743743987718,@PalmerReport Who's drinking lots of Corona for Cinco?,2020-05-05 17:59:49,0,0,Twitter for Android,54,180626604,OutspokenInk,OutSpoken Ink,2010-08-20 02:31:57,I am so sick of watching our democracy being tested on a daily basis. Never in my life have I been this angry on a daily basis. 1/20/21 the end of an error!,23,28,Florida,1768,False,,,No,NEGATIVE,0.9890747666358948
1257731739025317889,"@officialmcafee 
Usa has a Patent on corona virus
https://t.co/8mCGQHjpSd",2020-05-05 17:59:48,0,0,Twitter Web App,73,72130122,blackmaitreya,blacky,2009-09-06 21:34:53,"Breathe in breathe out, be happy and kind, one life, no rehearsal. Take time to smell the roses before you feed them.",154,681,here,412,False,,,No,NEGATIVE,0.9918065071105957
1257731738098372610,@bentzysu @corona_avi @dovidmargolin @AhinAher @Eli_Rubin @Mottel @shabboshouse Chabad Holocaust trivia question I… https://t.co/DnibLS0rfC,2020-05-05 17:59:48,0,0,Twitter for Android,139,842093899288051712,querynotfound,S.D. Homnick,2017-03-15 19:23:25,"Sentient being, or so I think. Toggling between grave and irreverent. Sifting through mud for the gems. The staccato rhythm of this bio is grating. רעדסט אידיש?",486,5002,"Brooklyn, NY",3211,False,,,No,NEGATIVE,0.9931039214134216
1257731737976819712,**I’ve been having on and off stomach issues since Saturday and I’m on my period. Not corona related.,2020-05-05 17:59:48,0,0,Twitter for iPhone,101,349377871,N0TBETHANY,b,2011-08-06 00:48:38,that’s just the hustle,339,248,Mile High✈️America’s Wang,20489,False,,,No,NEGATIVE,0.9955320358276367
1257731735736905728,@JeffreeStar So does Corona,2020-05-05 17:59:47,0,0,Twitter for Android,27,1256274273687068672,NicoleH29635453,I'm the Mc' Double,2020-05-01 17:28:46,Haha you're gay... but so am I soooooo --__( :/)__--,0,10,,9,False,,,No,POSITIVE,0.9899116158485413
1257731730464747522,@lizdobson Nothing matters anymore. Thanks corona,2020-05-05 17:59:46,0,1,Twitter for iPhone,49,2986445921,babybisonnikki,naughty little quesadilla,2015-01-19 22:10:02,bad decisions make great stories.,155,465,,6016,False,,,No,NEGATIVE,0.9597302675247192
1257731727520301059,Won’t happen corona 💃🏾 https://t.co/vFAofsG8OQ,2020-05-05 17:59:46,0,0,Twitter for iPhone,46,366789087,Omawumi101,OM HAIR,2011-09-02 20:40:16,"Curator / creative director @OMlifestyle_ , hair and beauty connoisseur.. Dm for virgin hair extensions 😉",12364,3042,Paradise ♥️,206380,False,,,No,NEGATIVE,0.9899922013282776
1257731726475960326,just remembered i would have been abt to leave for copenhagen if it weren't for corona ahaha,2020-05-05 17:59:45,0,0,Twitter for iPhone,92,850838466271232000,tilltoniight,via 🦋,2017-04-08 22:31:12,𓆏 19 ⚢ (𝐬𝐡𝐞/𝐡𝐞𝐫) 𓆣,1143,553,fl,17901,False,https://t.co/C7cbUvcgqZ,,Yes,NEGATIVE,0.9805265069007874
1257731726010462209,@SkyNews @Danish_Karen Don't tell me.....twas the corona virus.,2020-05-05 17:59:45,0,0,Twitter Web App,63,2947029323,hughesat10,Steven Hughes,2014-12-29 00:30:10,"United supporter, love the Quo,  dark sense of humour, no time for PC bollocks. Keep it pithy.",589,944,,7849,False,,,No,NEGATIVE,0.9978989362716675
1257731723791499264,"@polimernews @polimernews
 
Recently, private hospitals are asking pregnant ladies to take mandatory Corona test  i… https://t.co/9duY3FEbpq",2020-05-05 17:59:45,0,0,Twitter Web App,140,169144544,rajaaero,raja,2010-07-21 17:13:02,,16,106,,14,False,,,No,NEGATIVE,0.9878221154212952
1257731722713747456,@ericnamofficial yes but with masks and 6 feet apart corona is not playing,2020-05-05 17:59:44,0,0,Twitter for Android,74,3670183156,danlovesmrsuh,dan¹²⁷ㄴㄴㄱ,2015-09-16 02:20:52,lambretinha do chanyeol,238,746,,24573,False,,,No,NEGATIVE,0.9975588321685791
1257731713083428865,"#JusticeToGianSagarInterns
The @PunjabGovtIndia has not yet taken any decision for the #100_INTERNS of… https://t.co/VzTmVMidnt",2020-05-05 17:59:42,4,1,Twitter for Android,127,1674933644,DR_KULWINDERJBD,Dr. Kulwinder Singh,2013-08-16 05:55:21,"Shayar✍️
kulwinderajaabeala
MBBS 
GSMC",77,201,"Jalalabad, India",3989,False,,,No,NEGATIVE,0.9977533221244812
1257731707475722241,"The fight of Words or fight of Guns.
 
The world is moving into unpredictable zone. 

Let's find out which era  be… https://t.co/TjSLCYPuta",2020-05-05 17:59:41,0,0,Twitter for Android,139,137376428,SKSINGH194,SK SINGH,2010-04-26 15:37:08,Success n failure r periodic they come n go in our life what remains wid us is our good character.B HONEST,42,109, India,2695,False,,,No,NEGATIVE,0.6984683871269226
1257731701892997120,who woulda thought Corona would be ruining my Cinco De Mayo,2020-05-05 17:59:39,0,1,Twitter for iPhone,59,3058722781,jasons_stupid,⛄️,2015-03-02 22:18:57,,634,17,,6423,False,,,No,NEGATIVE,0.998572587966919
1257731701624713219,@ItsKubasu What if Italy? Were those who died of corona Muslims?,2020-05-05 17:59:39,1,1,Twitter for iPhone,64,67646648,FauzKhalid,AbuSakeena,2009-08-21 16:19:02,I speak Maritime Fluently.Retweets are not endorsements,22172,6245,"Mombasa, Kenya",180596,False,https://t.co/HOCVSVwJoe,,Yes,NEGATIVE,0.9977510571479797
1257731701574381568,@DethMetalBarbie @whipwhipwhip450 But you should. Goth the corona away,2020-05-05 17:59:39,0,0,Twitter for Android,70,148987154,defyourself,Shaundale,2010-05-28 03:37:53,Marine Vet. Photographer. Re-learning it all,349,308,Where Carmen San Diego Is,5864,False,https://t.co/jYS8Fg69ZL,,Yes,NEGATIVE,0.9939471483230591
1257731697107333126,This corona shit real as fuck shit Mainey,2020-05-05 17:59:38,0,0,Twitter for iPhone,41,1151620393209229312,Fat_Mackin,👶🏾Fat〽️ackin💰,2019-07-17 22:31:12,Street Clothing Designer🧵 Fat Mackin Clo 👕 EVENT Planner/Host🎉 Real Mackin EVENTS Business Inquiries: FatMackinBusiness@Gmail.com Student 🏈 Coach,1402,847,"Oakland, CA",23869,False,https://t.co/DUGmsovzVq,,Yes,NEGATIVE,0.9231129288673401
1257731693047398400,"(1/3)
Whole world is fighting against corona, but today people of ap fighting to get liquor bottles. It's absolute… https://t.co/emgdxnemag",2020-05-05 17:59:37,0,0,Twitter for Android,139,846553848214900736,bharathreddyya2,Bharathreddy,2017-03-28 02:45:40,Student,26,167,"Kurnool, India",25,False,,,No,NEGATIVE,0.9817948937416077
1257731690505486338,"#KCR garu CORONA washes Center and #Congress in his inimitable  style!!

#kcrpressmeet https://t.co/Ujrm5grnzW",2020-05-05 17:59:37,0,1,Twitter for Android,110,135061939,satyapamula,satya pamula,2010-04-20 06:47:03,"MICA Alumni I  Speaker I Strategist I Critic | Movies | Politics.

Tweets are personal, not endorsements.",321,479,"Hyderabad, India",5406,False,,,No,NEGATIVE,0.9583703279495239
1257731689641578496,@DapoCrownn Na Corona cause am oh,2020-05-05 17:59:36,0,0,Twitter for iPhone,33,776444368760737792,gboyinlagos,NIGERIAN PHOTOGRAPHER #OWAMBEGOD,2016-09-15 15:35:38,KANYIN,1960,1679,,33130,False,https://t.co/5mAskGbt8z,,Yes,NEGATIVE,0.9606624245643616
1257731689549385732,"@kuu_ire Yooooooooo. I totally forgot to tell you. But I did a thing to my head. 😁🌚

You'll see whenever corona passes and we meet",2020-05-05 17:59:36,0,0,Twitter for Android,130,36932628,kadi_akb,KaDi Yao Tay,2009-05-01 12:31:14,"Last interstellar shinobi from a galaxy far away. Pushing African comics, animation, digi art, games & speculative fiction. @SquidMag x @aaff_ia x Awam engineer",1164,923,📨kadi@squidmag.ink,27020,False,https://t.co/x9p6jpUHgG,,Yes,POSITIVE,0.9419918656349182
1257731686365827080,I started smoking cigarettes to prevent the corona and chased it with some bleach,2020-05-05 17:59:36,0,1,Twitter Web App,81,2914793841,F4celessTroll,Mr. Burns,2014-12-11 01:39:06,"this is a burner 


i support the miami hurricanes and Dolphins",746,878,Your mind rent free ,65504,False,,,No,NEGATIVE,0.9972872734069824
1257731682016231424,Maryann Little from Short Sale Mitigation goes over a list of lenders and what program options they are providing f… https://t.co/Qaypxtnfd2,2020-05-05 17:59:35,0,0,Twitter Web App,140,112006234,MaryanShortSale,Maryann Little - Short Sale Goddess,2010-02-06 23:10:22,978-384-0032 Broker Nick Aalerud Maryann Little help homeowners avoid foreclosure-Massachusetts. We work together with banks for SOLUTIONS.,1188,1582,Massachusetts,32688,False,http://t.co/qxOe96XG8I,,Yes,NEGATIVE,0.9981484413146973
1257731678447063042,They just found a new strain of corona... and y’all really think we finna be able to be out and about this month 🤣,2020-05-05 17:59:34,0,1,Twitter for iPhone,114,45943244,LovelyLadyShay_,Ayanna (Uh-Yun-Na)♌️,2009-06-09 21:01:35,R.I.P My Daddy/My Twin ❤ | 1913 🔺🐘 | (John 13:34) | UTK Alumna 🍊🐶 VFL | Ole Miss Grad Student ❤️💙,3459,2803,901 〽️,118685,False,,,No,NEGATIVE,0.7388952970504761
1257731677008191488,A more contagious strain of corona 🙄,2020-05-05 17:59:33,0,0,Twitter for iPhone,36,760918155770212352,craazar,Zach,2016-08-03 19:20:00,I've got nothing to say.,154,175,"West Covina, CA",908,False,,,No,NEGATIVE,0.995441198348999
1257731675427164167,@Narayanjat123 @RahulGandhi Where corona started from? China,2020-05-05 17:59:33,0,0,Twitter Web App,60,844984748766351360,abid44810049,Truth seeker,2017-03-23 18:50:37,,1,23,,655,False,,,No,NEGATIVE,0.9412223100662231
